<?xml version="1.0" encoding="UTF-8" ?>

<papers xmlns:xsi="http://www.w3.org/2001/XMLSchema-instance"
        xmlns="papersNamespace"
        xsi:schemaLocation="papersNamespace ../src/main/resources/papers.xsd">

    <newspaper id="ID-1" publication_date="1124-12-26">
        <title>Test newspaper1</title>
        <monthly>true</monthly>
        <color>false</color>
        <volume>15</volume>
        <type>newspaper</type>
        <glossy>false</glossy>
        <index>44654</index>
    </newspaper>

    <booklet id="ID-2" publication_date="0666-11-11">
        <title>Test booklet1</title>
        <monthly>true</monthly>
        <color>true</color>
        <volume>2</volume>
        <type>booklet</type>
        <glossy>true</glossy>
    </booklet>

    <magazine id="ID-3" publication_date="2365-03-15">
        <title>Test magazine1</title>
        <monthly>false</monthly>
        <color>true</color>
        <volume>33</volume>
        <type>magazine</type>
        <glossy>true</glossy>
        <index>469854</index>
    </magazine>


</papers>
